Reference,Country,Date,Year,Month,Title,Author,IsGov,Text,SentimentScore_nltk,PositiveCount_nltk,NegativeCount_nltk,TotalWords_nltk,Year_Chunk,polarity_textblob,subjectivity_textblob,neutral_finbert,positive_finbert,negative_finbert,polarity_score_finbert,Sentiment_vader,lexicon_score,roberta_sentiment
r120506a_BOE,United Kingdom,2012-05-06,2012.0,May,On counterparty risk,No_Info,No,counterparty risk unmonitorable example bank 1s ultimate counterparty bank 100 99 intervening links chain 99 degrees separation bank 1 way knowing identity counterparties exposed credit chain largely invisible gross debt unbounded debt system small gross debt much larger potentially unbounded specifically gross debt rises number links credit chain n example gross debt n counterparty risk unhedged example collateral capital held exposures severing link cascades along credit chain example bank 100 falls every link chain aggregate default would us9900 commensurately high deadweight costs financial system domino line improving network visibility counterparty one thing knowing counterparties counterparties counterparty quite another latter higherorder uncertainty killed financial markets crisis financial network opacity tackled fairly fundamental rethink way financial transactions identified recorded without common identifiers counterparties transaction types product attributes difficult see network could ever navigated elsewhere called creation common language finance like already exists wellperforming networks example global supply chains internet papers grody hughes reininger krishna explore dimensions solutions network opacity problem central counterparty clearing improving network transparency simultaneously reducing gross exposures netting reconfigure financial network example todays spaghettijunction configuration ordered hubandspoke configuration central counterparty obvious mechanism achieving state 2009 committed financial world centralclearing much wider range overthecounter financial products past effective central counterparties robust counterparty risk management allowed clear cleared margin set remaining risks managed allocated papers arnsdorf murphy analyse questions questions addressed official community stakes could not higher without adequate answers paper singh argues central counterparties risk becoming new virulent strain systemic virus protecting counterparty default transactions derivative cash instruments centrally cleared instruments counterparty risk less concern ongoing work official sector minimum margining requirements noncleared trades importance also adequate capitalisation counterparty risk noncollateralised derivative transactions important socalled credit valuation paper rosen explores adequacy calibration cva discussion risk maturity mismatch credit chains see hellwig 1995 systemic aspects risk management banking finance common financial language available market infrastructures available http regulatory framework resilient banks banking systems available,-24.8,5.0,30.0,313.0,2010–2014,0.051822326609560654,0.3274422031868841,0.006749398,0.99311393,0.000136601,0.9929773,-0.9924,-24.8,Neutral
r020204a_BOE,United Kingdom,2002-02-04,2002.0,February,Bankers Club/Guild Banquet,George,Yes,explain pet theory relativity based fact year passes smaller proportion gone must confess beginning doubts seems much 12 months ago last came together great annual gathering fact long hard year not policymakers around world also many financial services industry particularly international financial services industry cope synchronised global economic slowdown extension fall equity prices dotcoms spreading telecoms beyond even enron increasing credit risks vicious terrorist attacks 11 september aftermath finally around turn year sad climax argentinas long drawn crisis could easily go really long hard year shafts light amidst general gloom prefer focus evening terms global economy tentative signs worst may soon prospect gradual recovery move year provide support global equity markets inflationary pressures subdued monetary policy generally time least afford remain reasonably supportive though make predictions may mean interest rates crucially us international financial system far recognise problems often slow surface far stood well successive shocks much broadly encouraged asia crisis years ago recent pressures not generally called question real benefits market economy terms growth employment rising living standards rather contributed growing recognition benefits bypass poor countries poor communities within countries collective interest excluded one way another helped help participate benefits context globalisation reflected doha agreement new round world trade negotiations development financing theme monterrey summit next month increasing recognition private sector role play alongside governments encourage promote engagement private sector firms disadvantaged excluded sectors society charitable community involvement heart city campaign launched successfully andrew buxtons leadership last year encouraged evidence clear community interest financial authorities private sector commercial activity cooperation enabled system cope remarkably well potential dislocation following 11 september attacks congratulate federal reserve particular played part achievement cooperation contributing international financial war terrorism strengthening disaster contingency plans contributed flawless introduction euro notes coin eurozone well managed ecb many played part another example intensive consultation cooperation development basel 2 regime banking supervision encouraged finally continuing sense community among financial professionals london movingly evident spontaneous demonstration solidarity counterparts new york following september evident formation earlier last year guild international bankers cohosts evening lord mayor locum tenens founding master takes mantle perhaps appropriately takes ledger bankers club contributed much citys professional esprit de corps many years said long hard year president certainly positive moments like conclude paying tribute evening role city corporation mayoralty contribution many positive developments seen example promoting community involvement including support heart city campaign role maintaining security coordinating public infrastructure vital contingency plans support fundamentally international character city not least opening way guild profoundly grateful help support give us context ask rise join toast rt hon,-10.5,15.0,25.0,418.0,2000–2004,0.064384812,0.4152610441767068,0.06862842,0.8153333,0.11603829,0.69929504,0.9927,-10.5,Neutral
r000928a_BOE,United Kingdom,2000-09-28,2000.0,September,Iran Invest 2000 Conference,George,Yes,delighted able take part conference particularly pleased sharing platform morning first met governor nourbakhsh soon became governor 1994 not easy time iran immediately impressed not command issues confronting perhaps not surprising second period office governor meantime taken vacation minister economic affairs finance deputy president responsibility economic affairs immediately impressed calm always reasoned approach reliability played important role steering country difficult period promising prospect iran faces today since first meeting much enjoyed opportunity seeing governor periodically whole series international meetings great pleasure mohsen able join welcoming london morning immensely interested greatly encouraged tell us perhaps might add observations inevitably distant perspective much past two three years external environment facing iran difficult one slowdown world economic growth wake global financial crisis associated fall oil prices unsustainably low level significantly weakened financial positions major oilexporting countries iran exception current account swung surplus 22 gdp 199798 deficit 2 fiscal position deteriorated deficit 67 gdp irans response worsening economic conditions positive one authorities began formulate mediumterm reform strategy articulated third five year development plan since combination sound economic management home coupled continued economic expansion industrial countries rising oil prices improved irans prospects considerably gdp recorded 19992000 budgetary position swung deficit surplus 1 gdp 199900 foreign exchange reserves risen 2 billion 6 billion since 199899 although inflation remains still quite high around 20 broad money growth shown signs moderating debt levels also average emerging market economies perhaps else encouraging authorities not rested laurels instead sought take advantage recent favourable economic environment increase momentum reform overall macroeconomic prospect therefore positive one third fiveyear development plan represents ambitious step forward maps realistic sequence balanced liberalisation irans economy aim increasing growth 6 per annum average 25 19972000 generate employment opportunities growing labour force help raise living standards plan aims promote growth privatisation liberalisation enhance stability encouraging diversification economy macroeconomic policies plan aimed fiscal consolidation help reduce inflation broadening tax base including introduction vat unifying exchange rates marketdetermined level exchange controls loosened planned price distortions due state subsidies also decline ambitious wideranging plans key implementation climate business investment iran steadily improved past decade particular following election president khatami 1997 process liberalisation accelerated already progress privatisation especially hydrocarbon industry plans restructure privatise 500 state enterprises next 5 years commercialise autonomise irans stateowned banking system trade foreign investment encouraged extension irans freetrade zones new legislation expected soon simplify clarify law encouragement protection foreign investment clearly positive steps iran course opecs second largest producer second largest reserves gas world benefited recent rise oil prices playing positive role promoting stability oil market president khatami recently noted opec may need raise output proportion increase global oil demand stabilise prices government taken positive steps encourage foreign investment petroleum sector example facilitated foreign participation contracts redevelop oil fields also signed agreement consortium nine leading international oil gas companies study irans potential exporter gas government moreover actively seeking cushion economy future fluctuations oil price establishing oil stabilisation fund ensures government balance sheet strengthened oil price movements favourable help insure type debt servicing problems faced many emerging market economies difficult international environment 199798 iran able maintain excellent debt service record period prudent debt management policies help preserve record going forward total external debt expected decline around 10 gdp year shortterm debt 40 reserves fallen around 65 19992000 strong external position encouraged world bank approve loans 230 million year importantly hold iran good stead attracting inflows private capital crucial countrys long term growth prospects international financial crises 199798 stemmed largely vulnerabilities within countries financial systems aftermath crises official community assisting financial sectors emerging market economies technical assistance improved surveillance area notable success redesign international financial architecture key step regard joint imfworld bank initiative financial sector assessment programs fsaps fsap process designed identify assess strengths weaknesses financial systems best practice standpoint including assessing financial institutions structure soundness reviewing systemic risks payment systems examining legal framework system official oversight prudential regulation supervision assessing institutional arrangements crisis management including financial safety nets iran addressing aspects financial infrastructure formulating implementing reform programme iran maintained constructive engagement ifis particularly pleased bank england involved imfworld bank led technical assistance team financial sector restructuring supervisory regulatory frameworks banks iran coming year another key element efforts strengthen international financial architecture development implementation range international standards codes good practice codes not meant lay strict inflexible rules designed however promote best practices recognising financial systems likely differ across countries across time imf world bank working together relevant standardsetting bodies helping economies undertake assessments observance standards iran currently working towards adoption internationally accepted best practice standards number areas central bank developing new bank accounting framework represents move towards international accounting standards taking account special features islamic finance authorities also developing action plan implementing supervision reforms developments ought good news prospective investors iran also help illustrate international best practice standards flexible enough accommodate individual country circumstances move marketoriented environment brings new challenges example liberalising exchange controls freeing exchange rate market forces brings risks well opportunities sequenced approach capital account liberalisation helps mitigate risks route iran pursued not say reform stalled since mid1999 central bank taken important steps improve simplify foreign exchange market including allowing exchange rate depreciate market clearing levels march 2000 requirements surrender nonoil export receipts central bank abolished intention introduce direct interbank foreign exchange market eliminate advance import deposit requirement march 2001 important steps increasing irans exposure international competition turn contribute productive efficiency exchange rate unification partial liberalisation trade exchange controls make greater demands effectiveness monetary policy example monetary expansion may arise phased reduction banks reserve requirements important central bank develop effective monetary instruments sterilise monetary impact reforms support central banks target inflation issuance cds together partial liberalisation credit allocation sensible commendable steps know central bank actively considering additional possibilities measures make financial system iran efficient liquid transparent thereby attractive potential market entrants mr chairman economic progress one country not question countrys national interest todays increasingly economically financially integrated world matter collective international interest true macro microeconomic level level individual businesses firms think important encourage forces working reform liberalisation engaging constructively iran embarked upon ambitious realistically measured programme reform liberalisation third fiveyear development plan taking advantage present favourable conditions world economy advance programme wish governor nourbakhsh authorities iran possible success achieving objectives interests iranian people interest us,67.9,71.0,54.0,1027.0,2000–2004,0.13779817883266152,0.3970885579937304,0.4836767,0.5153435,0.000979781,0.5143637,0.9996,67.9,Positive
